<?xml version="1.0" encoding="UTF-8"?>
<tns:jobs xmlns:tns="http://www.example.org/JobDescription" xmlns:xsi="http://www.w3.org/2001/XMLSchema-instance" xsi:schemaLocation="http://www.example.org/JobDescription JobDescription.xsd ">
	<tns:job>
		<tns:name>Web Service Engineer</tns:name>
		<tns:description>Building web services</tns:description>
	</tns:job>
	<tns:job>
		<tns:name>Progrommer</tns:name>
		<tns:description>Do java C++ C# programming</tns:description>
	</tns:job>
	<tns:job>
		<tns:name>Ericsson Product Manager</tns:name>
		<tns:description>Product Manager</tns:description>
	</tns:job>
	<tns:job>
		<tns:name>Senior Java Programmer</tns:name>
		<tns:description>A senior java programmer</tns:description>
	</tns:job>
	<tns:job>
		<tns:name>Web Programmer</tns:name>
		<tns:description>PHP MySQL</tns:description>
	</tns:job>
	<tns:job>
		<tns:name>Chef Cook</tns:name>
		<tns:description>Cook in a french restaurant</tns:description>
	</tns:job>
</tns:jobs>
